{
  "$schema": "http://json-schema.org/draft-07/schema#",
  "$id": "http://pathways.rmi.org/schema/pathwayMetadata.v1.json",
  "title": "Pathway Metadata",
  "description": "A schema for the pathway metadata dataset in PBTAR.",
  "type": "object",
  "properties": {
    "$schema": {
      "description": "URI of the schema that validates this document (see https://json-schema.org/).",
      "type": "string",
      "maxLength": 1000
    },
    "id": {
      "description": "The unique identifier for a pathway.",
      "type": "string",
      "maxLength": 100
    },
    "name": {
      "description": "Name of the pathway.",
      "$ref": "http://pathways.rmi.org/schema/common/label.v1.json",
      "tsType": "import('./common/label.v1').LabelV1"
    },
    "description": {
      "description": "Brief description of the pathway.",
      "type": "string",
      "pattern": "\\.$",
      "maxLength": 100
    },
    "publication": {
      "description": "Bibliographic information about the report or dataset.",
      "$ref": "http://pathways.rmi.org/schema/common/publication.v1.json",
      "tsType": "import('./common/publication.v1').PublicationV1"
    },
    "pathwayType": {
      "description": "Type of the pathway pathway.",
      "type": "string",
      "enum": ["Normative", "Exploratory", "Predictive"]
    },
    "modelYearNetzero": {
      "description": "Year by which net zero is reached in the pathway. If Pathway does not reach net zero, this field should be omitted.",
      "type": "integer",
      "minimum": 2030,
      "maximum": 2100
    },
    "modelYearStart": {
      "description": "Year from which the model starts.",
      "type": "integer",
      "minimum": 1900,
      "maximum": 2030
    },
    "modelYearEnd": {
      "description": "Year in which the model ends.",
      "type": "integer",
      "minimum": 2030,
      "maximum": 2100
    },
    "modelTempIncrease": {
      "description": "Modeled temperature increase expected by the pathway (in degrees Celsius).",
      "type": "number",
      "multipleOf": 0.1,
      "minimum": 0.5,
      "maximum": 3
    },
    "geography": {
      "description": "Geographical areas that the pathway covers.",
      "$ref": "http://pathways.rmi.org/schema/common/geography.v1.json",
      "tsType": "import('./common/geography.v1').GeographyV1"
    },
    "sectors": {
      "description": "Sectors that the pathway covers.",
      "type": "array",
      "items": {
        "type": "object",
        "properties": {
          "name": {
            "$ref": "http://pathways.rmi.org/schema/common/sector.v1.json#/$defs/displayName"
          },
          "technologies": {
            "type": "array",
            "description": "Technologies applicable to this sector.",
            "items": {
              "$ref": "http://pathways.rmi.org/schema/common/technology.v1.json#/$defs/displayName"
            }
          }
        },
        "required": ["name", "technologies"],
        "additionalProperties": false
      }
    },
    "pathwayOverview": {
      "description": "Overview of the pathway.",
      "type": "string",
      "pattern": "\\.$",
      "maxLength": 1000
    },
    "expertOverview": {
      "description": "Expert recommendation for the pathway.",
      "type": "string",
      "pattern": "\\.$",
      "maxLength": 10000
    },
    "metric": {
      "type": "array",
      "uniqueItems": true,
      "items": {
        "$ref": "http://pathways.rmi.org/schema/common/metric.v1.json#/$defs/displayName",
        "tsType": "import('./common/metric.v1').MetricV1['displayName']"
      }
    },
    "keyFeatures": {
      "description": "Key features of the pathway.",
      "type": "object",
      "properties": {
        "emissionsTrajectory": {
          "description": "Describes the overall trend of greenhouse gas emissions over time, from continued growth to rapid decline.",
          "type": "string",
          "enum": [
            "No information",
            "Significant increase",
            "Moderate increase",
            "Minor increase",
            "Low or no change",
            "Minor decrease",
            "Moderate decrease",
            "Significant decrease"
          ]
        },
        "energyEfficiency": {
          "description": "Indicates how efficiently energy is used to produce economic output across the sectors covered in the pathway.",
          "type": "string",
          "enum": [
            "No information",
            "Significant deterioration",
            "Moderate deterioration",
            "Minor deterioration",
            "Low or no change",
            "Minor improvement",
            "Moderate improvement",
            "Significant improvement"
          ]
        },
        "energyDemand": {
          "description": "Captures the change in total energy consumption, driven by factors such as socio-economic development, technology shifts and consumer behavior.",
          "type": "string",
          "enum": [
            "No information",
            "Significant decrease",
            "Moderate decrease",
            "Minor decrease",
            "Low or no change",
            "Minor increase",
            "Moderate increase",
            "Significant increase"
          ]
        },
        "electrification": {
          "description": "Represents the extent to which energy end-uses transition from fossil fuels to electricity.",
          "type": "string",
          "enum": [
            "No information",
            "Significant decrease",
            "Moderate decrease",
            "Minor decrease",
            "Low or no change",
            "Minor increase",
            "Moderate increase",
            "Significant increase"
          ]
        },
        "policyTypes": {
          "description": "Identifies the types of policies modeled as drivers of the pathway, such as carbon pricing, subsidies, or mandated phaseouts of specific technologies.",
          "type": "array",
          "uniqueItems": true,
          "minItems": 1,
          "items": {
            "type": "string",
            "enum": [
              "Carbon price",
              "Feed-in tariffs",
              "Performance standards",
              "Phaseout dates",
              "Subsidies",
              "Target technology shares",
              "Other",
              "None"
            ]
          }
        },
        "technologyCostTrend": {
          "description": "Describes how technology costs evolve over time, from static cost assumptions to rapidly declining costs (e.g., via learning curves).",
          "type": "string",
          "enum": ["No information", "Increase", "Low or no change", "Decrease"]
        },
        "emissionsScope": {
          "$ref": "http://pathways.rmi.org/schema/common/emissionsScope.v1.json",
          "tsType": "import('./common/emissionsScope.v1').EmissionsScopeV1"
        },
        "policyAmbition": {
          "description": "Represents the overall stringency and intent of modeled policies relative to climate targets, often reflecting if and how far the included policies go beyond currently legislated ones",
          "type": "string",
          "enum": [
            "No information",
            "No policies included",
            "Current/legislated policies",
            "Current and drafted policies",
            "NDCs, unconditional only",
            "NDCs incl. conditional targets",
            "High ambition policies",
            "Other policy ambition"
          ]
        },
        "technologyCostsDetail": {
          "description": "Specifies the level of granularity in cost data, such as total system costs or detailed CAPEX/OPEX breakdowns.",
          "type": "string",
          "enum": [
            "No information",
            "Total costs",
            "Capital costs, O&M, etc.",
            "Other cost breakdown"
          ]
        },
        "newTechnologiesIncluded": {
          "description": "Lists emerging or breakthrough technologies that are explicitly modeled within the pathway. These are considered in technology deployment too.",
          "type": "array",
          "uniqueItems": true,
          "minItems": 1,
          "items": {
            "type": "string",
            "enum": [
              "No information",
              "No new technologies",
              "CCUS",
              "DAC",
              "Green H2/ammonia",
              "SAF",
              "Battery storage",
              "EGS/AGS",
              "Other new technologies"
            ]
          }
        },
        "investmentNeeds": {
          "description": "Summarizes how investment requirements are quantified, from total system to sector-level or supply-chain detail.",
          "type": "string",
          "enum": [
            "No information",
            "Total investment",
            "By sector",
            "By sector, part of value chain",
            "By technology",
            "By tech, part of value chain"
          ]
        }
      },
      "additionalProperties": false,
      "required": [
        "emissionsTrajectory",
        "energyEfficiency",
        "energyDemand",
        "electrification",
        "policyTypes",
        "technologyCostTrend",
        "emissionsScope",
        "policyAmbition",
        "technologyCostsDetail",
        "newTechnologiesIncluded",
        "investmentNeeds"
      ]
    }
  },
  "additionalProperties": false,
  "required": [
    "id",
    "name",
    "description",
    "publication",
    "pathwayType",
    "geography",
    "sectors",
    "expertOverview",
    "metric",
    "keyFeatures"
  ]
}
