{
  "$schema": "http://pathways.rmi.org/schema/pathwayMetadata.v1.json",
  "id": "pathway-minimal",
  "name": {
    "full": "Minimal Pathway"
  },
  "publication": {
    "title": {
      "full": "Example Title"
    },
    "publisher": {
      "full": "TransitionZero"
    },
    "year": 2024
  },
  "description": "A minimal pathway file that passes schema validation.",
  "pathwayType": "Exploratory",
  "geography": {
    "regions": {
      "South East Asia": []
    }
  },
  "sectors": [
    {
      "name": "Other",
      "technologies": ["Other"]
    }
  ],
  "pathwayOverview": "This is a minimal pathway for testing purposes.",
  "expertOverview": "Test recommendation.",
  "metric": ["Capacity"],
  "keyFeatures": {
    "emissionsTrajectory": "No information",
    "energyEfficiency": "No information",
    "energyDemand": "No information",
    "electrification": "No information",
    "policyTypes": ["Other"],
    "technologyCostTrend": "No information",
    "emissionsScope": "No information",
    "policyAmbition": "No information",
    "technologyCostsDetail": "No information",
    "newTechnologiesIncluded": ["No information"],
    "investmentNeeds": "No information"
  }
}
